{
  "$schema": "https://json-schema.org/draft/2020-12/schema",
  "$id": "https://schemas.convsim.dev/v0.1/npc.schema.json",
  "title": "ConvSim NPC",
  "description": "Validates an NPC definition file. All NPCs must be fictional.",
  "type": "object",
  "required": [
    "schema_version",
    "npc_id",
    "display_name",
    "archetype",
    "fictional",
    "age_band",
    "public_persona",
    "private_persona"
  ],
  "additionalProperties": false,
  "properties": {
    "schema_version": {
      "type": "string",
      "enum": ["0.1"]
    },
    "npc_id": {
      "type": "string",
      "pattern": "^[a-z0-9_]+$"
    },
    "display_name": {
      "type": "string",
      "minLength": 1,
      "maxLength": 100
    },
    "archetype": {
      "type": "string",
      "description": "Behaviour archetype slug used for system prompt construction.",
      "pattern": "^[a-z0-9_]+$"
    },
    "fictional": {
      "type": "boolean",
      "description": "Must be true. Real-person impersonation is not permitted in MVP.",
      "const": true
    },
    "age_band": {
      "type": "string",
      "enum": ["adult"],
      "description": "Only 'adult' NPCs are permitted in MVP."
    },
    "voice": {
      "type": "object",
      "additionalProperties": false,
      "properties": {
        "engine": {
          "type": "string",
          "enum": ["kokoro", "sherpa-onnx", "none"]
        },
        "voice_id": { "type": "string" }
      }
    },
    "licensed_persona": {
      "$comment": "Reserved for a future licensed persona namespace. Not implemented in schema v0.1. This field is explicitly blocked to prevent incompatible use before the namespace is defined.",
      "not": {}
    },
    "portrait": {
      "type": "string",
      "description": "Relative path to portrait image within the pack."
    },
    "attack_surface": {
      "type": "array",
      "description": "The roastable topology of this character: what about them is fair game. Read by flyting scenarios (scenario mode: flyting) — the per-volley judge may only claim a hook whose id appears here, and the engine drops any claim whose quoted evidence is not actually present in the player's volley. Ignored by conversation-mode scenarios.",
      "minItems": 1,
      "maxItems": 8,
      "uniqueItems": true,
      "items": {
        "type": "object",
        "required": ["id", "brief"],
        "additionalProperties": false,
        "properties": {
          "id": {
            "type": "string",
            "description": "Stable trait id, unique within this NPC. Referenced by judge hooks and calibration fixtures.",
            "pattern": "^[a-z0-9_]+$",
            "maxLength": 40
          },
          "brief": {
            "type": "string",
            "description": "One or two sentences a player (or the judge) can aim at.",
            "minLength": 1,
            "maxLength": 300
          },
          "visibility": {
            "type": "string",
            "enum": ["visible", "discoverable"],
            "default": "visible",
            "description": "visible = in the player brief from the start. discoverable = revealed when first struck, and worth double on discovery."
          },
          "themes": {
            "type": "array",
            "description": "Theme slugs this trait belongs to. Authoring metadata: it round-trips through the pack and the Creator Workbench, and it is the seam where a trait's themes would anchor the judge's own tagging, but the engine does not read it today. Theme decay is computed from the themes the judge tags on a volley (the closed `themes` vocabulary on the volley scorecard), not from these.",
            "items": { "type": "string", "pattern": "^[a-z0-9_]+$", "maxLength": 40 },
            "maxItems": 6,
            "uniqueItems": true
          }
        }
      }
    },
    "public_persona": {
      "type": "object",
      "required": ["occupation", "speaking_style", "demeanor"],
      "additionalProperties": false,
      "properties": {
        "occupation": { "type": "string" },
        "speaking_style": { "type": "string" },
        "demeanor": { "type": "string" }
      }
    },
    "private_persona": {
      "type": "object",
      "additionalProperties": false,
      "properties": {
        "hidden_agenda": {
          "type": "array",
          "items": { "type": "string" }
        },
        "biases_to_simulate": {
          "type": "array",
          "items": { "type": "string" }
        },
        "boundaries": {
          "type": "array",
          "items": { "type": "string" },
          "description": "Hard rules the NPC must never violate."
        }
      }
    }
  }
}
